,author,statements,source,date,target,BinaryTarget,BinaryNumTarget
1937,Tom Kertscher,"“Joe Biden puts pro-life groups on domestic extremist list, calls pro-life people ‘violent.’”",Facebook posts,"31, 2021 2021",barely-true,FALSE,0
1938,Samantha Putterman,The ship that was stuck in the Suez Canal was a planned or staged event.,Instagram posts,"30, 2021 2021",false,FALSE,0
1939,Bill McCarthy,"Says Rachel Levine was Time magazine's ""Woman of the Year.""",Facebook posts,"30, 2021 2021",false,FALSE,0
1940,Noah Y.,Nostradamus predicted that a “feeble man” would rule the “Western World” after a time of “plague.”,Facebook posts,"March 30, 30,",pants-fire,FALSE,0
1941,Madison Czopek,Says Sen. Cory Booker wants to require a federal license for gun owners but criticizes voter ID laws as discriminatory.,Viral image,"30, 2021 2021",mostly-true,FALSE,0
1942,Tom Kertscher,"“Less than 500 people a year killed by all rifles combined” and “4,000 a year killed by illegals.”",Facebook posts,"30, 2021 2021",barely-true,FALSE,0
1943,Tom Kertscher,"Says the suspected Boulder mass shooter is a Muslim ""who entered illegally from Mexico and purchased the firearm from a guy that sells stolen guns.""",Facebook posts,"30, 2021 2021",barely-true,FALSE,0
1944,Bill McCarthy,“Toxicology report was made public by the MN prosecution revealing the cause of George Floyd’s death was a fentanyl overdose.”,Facebook posts,"30, 2021 2021",false,FALSE,0
1945,Gabrielle Settles,"Says Jimmy Kimmel, Jimmy Fallon and Stephen Colbert are “still not doing Biden jokes.""",Facebook posts,"30, 2021 2021",false,FALSE,0
1946,Samantha Putterman,Says Google Earth blocked people from seeing the Suez Canal.,Facebook posts,"29, 2021 2021",false,FALSE,0
1947,Noah Y.,Nike and Lil Nas X are launching “demonic shoes” containing human blood.,Facebook posts,"March 29, 29,",half-true,FALSE,0
1948,Michael Majchrowicz,“In a vegan world there would be no pandemics. 100% of pandemics are zoonotic in origin.”,Facebook posts,"29, 2021 2021",barely-true,FALSE,0
1949,Bill McCarthy,"""Ted Cruz says owning a gun should be as hassle free as owning a car, which as I recall requires a license and registration.""",Facebook posts,"29, 2021 2021",false,FALSE,0
1950,Ciara O'Rourke,Bull sharks were released in an Arkansas river.,Viral image,"25, 2021 2021",false,FALSE,0
1951,Ciara O'Rourke,Passports aren’t required to enter the United States from Mexico and Canada.,Facebook posts,"25, 2021 2021",barely-true,FALSE,0
1952,Daniel Funke,"""Suez Canal blocked by huge container ship named Evergreen. Evergreen shipping is most likely a cover for human and sex trafficking” by Hillary Clinton.",Facebook posts,"25, 2021 2021",pants-fire,FALSE,0
1953,Bill McCarthy,"A CNN chyron said the Boulder “shooter was factually Arabic, but morally white.”",Facebook posts,"25, 2021 2021",pants-fire,FALSE,0
1954,Tom Kertscher,"""80% of people taking the Moderna vaccine had significant side effects, via Bill Gates.""",Facebook posts,"25, 2021 2021",false,FALSE,0
1955,Daniel Funke,“New information coming in that Boulder shooter was a Syrian refugee who arrived via Obama-era asylum programs.”,Jack Posobiec,"24, 2021 2021",barely-true,FALSE,0
1956,Noah Y.,"The “president of Drag Queen Story Hour” was “arrested, charged with child pornography.”",Facebook posts,"March 24, 24,",false,FALSE,0
1957,Tom Kertscher,"“Finally, a judge has ruled Dominion voting machines were designed to create fraud.”",Facebook posts,"23, 2021 2021",false,FALSE,0
1958,Ciara O'Rourke,"“Last week, the Colorado Supreme Court declared that Boulder’s AR-15 ban was unconstitutional. Today, there was a mass shooting in Boulder.”",Viral image,"23, 2021 2021",half-true,FALSE,0
1959,Daniel Funke,"The shooting in Boulder, Colo., was a ""false flag like most of the others.""",Facebook posts,"23, 2021 2021",pants-fire,FALSE,0
1960,Ciara O'Rourke,“Texas has launched ‘Operation Lone Star’ to finish the border wall themselves.”,Facebook posts,"23, 2021 2021",false,FALSE,0
1961,Ciara O'Rourke,"Gas costs $7.89 at a station in Albuquerque, New Mexico.",Viral image,"23, 2021 2021",false,FALSE,0
1962,Samantha Putterman,The movie “I am Legend” was based in the year 2021 and people turned into zombies “because of the wrong vaccine.”,Facebook posts,"22, 2021 2021",false,FALSE,0
1963,Ciara O'Rourke,“Jamaica has not recorded any case of the coronavirus.”,Viral image,"22, 2021 2021",pants-fire,FALSE,0
1964,Andy Nguyen,Aluminum “is in the vaccine” and will hurt the brain.,Instagram posts,"22, 2021 2021",false,FALSE,0
1965,Noah Y.,"“Joe Biden and Kamala Harris forced our troops to sleep on the floor of a garage, yet has authorized $89 million for hotel rooms for illegal immigrants.”",Facebook posts,"March 22, 22,",barely-true,FALSE,0
1966,Ciara O'Rourke,Says Disneyland is enforcing a “no scream” policy on roller coasters.,Viral image,"22, 2021 2021",false,FALSE,0
1967,Ciara O'Rourke,Video “proves 100% that President Joe Biden is not a ‘human’ being.”,Viral image,"22, 2021 2021",pants-fire,FALSE,0
1968,Daniel Funke,“You will need a WHO Yellow Vaccination Passport if you plan on traveling internationally once borders open.”,TikTok posts,"22, 2021 2021",barely-true,FALSE,0
1969,Samantha Putterman,"“Pelosi’s $1.9 trillion bailout gives EVERY federal employee a $21,000 bonus check… they never lost their job!”",Facebook posts,"19, 2021 2021",false,FALSE,0
1970,Bill McCarthy,"“Black Lives Matter of Atlanta Charged with Wire Fraud, Money Laundering and Allegedly Using almost 500k in Donations For Personal Use.”",Tweets,"19, 2021 2021",false,FALSE,0
1971,Michael Majchrowicz,"Says Burisma admitted in a Ukrainian court to paying Joe Biden $900,000.",Facebook posts,"19, 2021 2021",false,FALSE,0
1972,Noah Y.,A CDC study found that “mask mandates made no statistical difference” on coronavirus case rates.,Bloggers,"March 19, 19,",pants-fire,FALSE,0
1973,Ciara O'Rourke,"Says Candace Owens tweeted, “Yes, my husband did cheat on me with my brother. Yes, he said no when I asked to join.”",Viral image,"19, 2021 2021",false,FALSE,0
1974,Ciara O'Rourke,Video shows Joe Biden faked an interview in front of a green screen.,YouTube videos,"18, 2021 2021",pants-fire,FALSE,0
1975,Samantha Putterman,The Atlanta shooting suspect wrote an anti-China post on Facebook prior to the shootings.,Facebook posts,"18, 2021 2021",false,FALSE,0
1976,Ciara O'Rourke,“70% of Georgians said they would vote for Trump in 2024.”,Mike Huckabee,"18, 2021 2021",false,FALSE,0
1977,Sudiksha Kochi,Says Meghan Markle tweeted about Oprah Winfrey following her primetime interview.,Viral image,"17, 2021 2021",pants-fire,FALSE,0
1978,Samantha Putterman,A photo shows a recent White House event was actually filmed at Tyler Perry Studios in Atlanta.,Facebook posts,"17, 2021 2021",pants-fire,FALSE,0
1979,Ciara O'Rourke,“Actor Tom Hanks has passed away age 63.”,Viral image,"17, 2021 2021",pants-fire,FALSE,0
1980,Daniel Funke,"Says Joe Biden is “now saying he inherited ‘a mess’ at the border. Fact: 9,000 illegals all of 2020. So far in 2021 108,000 entered U.S.”",Facebook posts,"17, 2021 2021",false,FALSE,0
1981,Ciara O'Rourke,"Says Kamala Harris said, “We will be shuttering the VA… the money saved will go to better use in assisting refugee families.”",Viral image,"17, 2021 2021",pants-fire,FALSE,0
1982,Monique Curet,"Says “Fallon (Fox), a transgender MMA fighter, has now broken 2 female opponents’ skulls,” and shows a photo of Fox alongside an MMA fighter with a severely bloodied face.",Facebook posts,"16, 2021 2021",barely-true,FALSE,0
1983,Tom Kertscher,“Donald J. Trump’s signature is on the new stimulus checks.”,Facebook posts,"16, 2021 2021",false,FALSE,0
1984,Tom Kertscher,Hank Aaron and Marvelous Marvin Hagler died “after taking the COVID-19 vaccine.”,Aubrey Huff,"16, 2021 2021",false,FALSE,0
1985,Tom Kertscher,"""90% of Americans do not support universal background checks.""",Colion Noir,"15, 2021 2021",false,FALSE,0
1986,Samantha Putterman,"Vaccines send the immune system into “perpetual overdrive” by instructing cells to keep “making the protein of an invader, nonstop, forever and ever.”",Facebook posts,"15, 2021 2021",false,FALSE,0
1987,Ciara O'Rourke,“Fauci admits he isn’t listening to the science when advocating policy.”,Facebook posts,"15, 2021 2021",false,FALSE,0
1988,Tom Kertscher,"“Illegal aliens will receive $1,400 stimulus checks.”",Facebook posts,"12, 2021 2021",barely-true,FALSE,0
1989,Michael Majchrowicz,Says Meghan Markle was paid $7 million for giving an interview to Oprah.,Viral image,"12, 2021 2021",false,FALSE,0
1990,Ciara O'Rourke,Says Rachel Levine “is telling us that Dr. Seuss books and Mr. Potato Head are bad for the children.”,Viral image,"12, 2021 2021",false,FALSE,0
1991,Madison Czopek,There are nanoparticles in the COVID-19 vaccine that will help people “locate you” via 5G networks.,Facebook posts,"12, 2021 2021",pants-fire,FALSE,0
1992,Bill McCarthy,"Says President Joe Biden promoted ""mandatory vaccines for everybody"" in his March 11 address.",Facebook posts,"12, 2021 2021",false,FALSE,0
1993,Ciara O'Rourke,"“Next week has a time change, full moon and Friday the 13th.”",Viral image,"12, 2021 2021",false,FALSE,0
1994,Samantha Putterman,Says El Chapo testified in court that he paid off Nancy Pelosi to keep the U.S.-Mexico border open for drug cartels.,Facebook posts,"12, 2021 2021",pants-fire,FALSE,0
1995,Samantha Putterman,Says Oprah Winfrey for years “pimped young Hollywood girls to Harvey Weinstein to be raped.”,Facebook posts,"11, 2021 2021",pants-fire,FALSE,0
1996,Ciara O'Rourke,"“Nevada AG admits to changing signature verifications manually for over 200,000 votes.”",Facebook posts,"11, 2021 2021",false,FALSE,0
1997,Ciara O'Rourke,“Navy SEALs arrest Hillary Clinton.”,Bloggers,"11, 2021 2021",pants-fire,FALSE,0
1998,Ciara O'Rourke,"Vitamin D, vitamin C, colloidal silver and black seed oil can kill the coronavirus.",Instagram posts,"11, 2021 2021",false,FALSE,0
1999,Jon Greenberg,“Schumer and Pelosi sneak funding into COVID bill.”,Bloggers,"11, 2021 2021",false,FALSE,0
2000,Tom Kertscher,"The $1.9 trillion COVID-19 relief bill ""awards a $25 million bonus"" to House members.",Facebook posts,"11, 2021 2021",pants-fire,FALSE,0
2001,Amy Sherman,"Under HR 1, a person can still vote if they are 16, in the U.S. illegally, have no ID and have not registered to vote",Facebook posts,"10, 2021 2021",barely-true,FALSE,0
2002,Ciara O'Rourke,“Biden is making ‘maternity flight suits’ so pregnant women can fight in the military.”,Bloggers,"10, 2021 2021",barely-true,FALSE,0
2003,Tom Kertscher,Says Alexandria Ocasio-Cortez's net worth is “over $1 million.”,Facebook posts,"10, 2021 2021",pants-fire,FALSE,0
2004,Samantha Putterman,A video shows a nurse pretending to vaccinate actor Anthony Hopkins before squirting fluid in the syringe on the floor.,Instagram posts,"10, 2021 2021",false,FALSE,0
2005,Tom Kertscher,Says Joe Biden executive orders caused price increases of 50 cents in gas and 10% in food.,Facebook posts,"10, 2021 2021",false,FALSE,0
2006,Ciara O'Rourke,“Schools banning Dr. Seuss books.”,Viral image,"10, 2021 2021",false,FALSE,0
2007,Amy Sherman,The Georgia House passed a bill that “makes it a misdemeanor to give food or water to voters waiting in line.”,Facebook posts,"9, 2021 2021",true,REAL,1
2008,Tom Kertscher,“Ballots in Arizona’s Maricopa County” from the 2020 presidential election “found shredded and in dumpster days before Senate audit to begin.”,The Gateway Pundit,"9, 2021 2021",false,FALSE,0
2009,Ciara O'Rourke,Says Oprah Winfrey was wearing an ankle monitor during her Meghan Markle interview.,Facebook posts,"9, 2021 2021",pants-fire,FALSE,0
2010,Madison Czopek,Video suggests Dr. Anthony Fauci said vaccines don’t protect against COVID-19.,Instagram posts,"8, 2021 2021",false,FALSE,0
2011,Tom Kertscher,"In Aberdeen, Miss., “Massive 78% of mail-in ballots proved fraudulent, judge orders election do-over.”",Facebook posts,"5, 2021 2021",mostly-true,FALSE,0
2012,Ciara O'Rourke,Video shows someone wearing an Anthony Fauci mask.,Viral image,"5, 2021 2021",pants-fire,FALSE,0
2013,Samantha Putterman,“Biden took down Dr. Seuss and Mr. Potato Head.”,Facebook posts,"5, 2021 2021",false,FALSE,0
2014,Ciara O'Rourke,Photos show U.S. senators sleeping in the chamber.,Viral image,"5, 2021 2021",false,FALSE,0
2015,Monique Curet,Says 5-year-olds can “take hormones and change my sex.”,Viral image,"5, 2021 2021",false,FALSE,0
2016,Ciara O'Rourke,“NASA discovers THC on meteorite fragment.”,Viral image,"4, 2021 2021",pants-fire,FALSE,0
2017,Daniel Funke,"""Some people are going to die from the vaccine directly. But a large number of people are going to start getting horribly sick and get all kinds of autoimmune diseases.""",Sherri Tenpenny,"4, 2021 2021",pants-fire,FALSE,0
2018,Tom Kertscher,"""Marco Rubio's 'red flag' gun confiscation bill"" calls for guns to be confiscated ""without due process, based on unsubstantiated accusations.""",National Association for Gun Rights,"4, 2021 2021",barely-true,FALSE,0
2019,Noah Y.,"Says Donald Trump will be re-inaugurated as president on March 4, 2021.",Facebook posts,"March 3, 3,",pants-fire,FALSE,0
2020,Noah Y.,Says Rachel Levine supports “government-funded sex reassignment surgery without parental notification or authorization” for all children.,Facebook posts,"March 2, 2,",false,FALSE,0
2021,Samantha Putterman,Says a photo at CPAC shows evangelical leaders praying over a golden statue of former President Donald Trump.,Viral image,"2, 2021 2021",false,FALSE,0
2022,Ciara O'Rourke,“Instagram has been limiting our posts so that no more than 7% of our friends see our posts.”,Viral image,"2, 2021 2021",false,FALSE,0
2023,Samantha Putterman,Says Al Gore said in 2009 that “the North Pole will be ice-free in the summer by 2013 because of man-made global warming.”,Facebook posts,"2, 2021 2021",mostly-true,FALSE,0
2024,Monique Curet,Says Nancy Pelosi bought $1.5 million “in foreign oil stock day before shut down of American line.”,Facebook posts,"1, 2021 2021",false,FALSE,0
2025,Tom Kertscher,"“America has 133 million registered voters,” but “159 million votes” were cast in the 2020 presidential election.",Facebook posts,"1, 2021 2021",false,FALSE,0
2026,Samantha Putterman,"Says Kaleb Torres, a young spokesperson for Shriners Hospitals for Children, has died.",Facebook posts,"1, 2021 2021",false,FALSE,0
2027,Ciara O'Rourke,Identification is required “to get into Washington DC.”,Facebook posts,"1, 2021 2021",false,FALSE,0
2028,Tom Kertscher,Says the Atlanta mayor is “shutting the city down for” the NBA All-Star Game weekend.,Facebook posts,"1, 2021 2021",false,FALSE,0
2029,Tom Kertscher,The COVID-19 rescue bill includes money for a list of projects that are not COVID-related.,Stand for America,"26, 2021 2021",mostly-true,FALSE,0
2030,Noah Y.,"“If you take the vaccine, you'll be enrolled in a pharmacovigilance tracking system. It means that you've enrolled yourself in a medical trial.”",Simone Gold,"February 26, 26,",false,FALSE,0
2031,Daniel Funke,Says Jerry Nadler said “God has no authority in the House of Representatives”,Facebook posts,"26, 2021 2021",false,FALSE,0
2032,Daniel Funke,"The COVID-19 vaccine could lead to prion diseases, Alzheimer’s, ALS and other neurodegenerative diseases.",J. Bart Classen,"26, 2021 2021",pants-fire,FALSE,0
2033,Samantha Putterman,"Due to differing lockdown orders, New York has more COVID-19 cases, deaths, hospitalizations and job losses than Florida, and New York also lags on vaccinations.",Instagram posts,"26, 2021 2021",barely-true,FALSE,0
2034,Ciara O'Rourke,Says Joe Biden said a racial slur.,Facebook posts,"26, 2021 2021",false,FALSE,0
2035,Bill McCarthy,Insulin prices rose “with the swipe of (Joe Biden’s) pen.”,Facebook posts,"25, 2021 2021",false,FALSE,0
2036,Amy Sherman,"HR 1 will allow members of Congress to draw a second salary “worth an estimated $600,000 per year!”",Act for America,"25, 2021 2021",false,FALSE,0
2037,Samantha Putterman,Says a video captures sound from the surface of Mars,Facebook posts,"25, 2021 2021",false,FALSE,0
2038,Samantha Putterman,"Says President Joe Biden canceled Trump’s “child sex ring operation, which saw thousands of arrests last year.”",Facebook posts,"25, 2021 2021",false,FALSE,0
2039,Tom Kertscher,"Only Nancy Pelosi is “responsible for what happened at the Capitol” on Jan. 6, “security at the Capitol is her job.”",Facebook posts,"25, 2021 2021",barely-true,FALSE,0
2040,Noah Y.,Nancy Pelosi explains how Democrats demonize political opponents through the “wrap-up smear.”,YouTube videos,"February 25, 25,",pants-fire,FALSE,0
2041,Ciara O'Rourke,"Says Coca-Cola CEO James Quincey said, “A few right winged nuts won’t affect our bottom line.”",Facebook posts,"24, 2021 2021",false,FALSE,0
2042,Ciara O'Rourke,"Says Joe Biden tweeted, “the way white people talk leaving minorities confused.”",Viral image,"24, 2021 2021",pants-fire,FALSE,0
2043,Bill McCarthy,"""The reality"" in Texas is that ""you’re flying helicopters, using fossil fuels, to put oil on wind turbines to defrost them.”",Lara Logan,"24, 2021 2021",false,FALSE,0
2044,Ciara O'Rourke,"Photo shows “Earth, Venus and Jupiter as seen from Mars.”",Viral image,"24, 2021 2021",false,FALSE,0
2045,Tom Kertscher,"“Oil is now $61.30 a barrel and rising drastically! On Jan. 5, it was about $25 a barrel.”",Facebook posts,"24, 2021 2021",false,FALSE,0
2046,Daniel Funke,Facebook users can avoid “problems with your Facebook going against community standards” by changing your settings.,Facebook posts,"24, 2021 2021",pants-fire,FALSE,0
2047,Ciara O'Rourke,“Nancy Pelosi has invited all illegals to her mansion at 2724 Pacific Ave San Francisco CA.”,Viral image,"24, 2021 2021",false,FALSE,0
2048,Ciara O'Rourke,“Monticello power plant just outside of Pittsburg TX has been closed since 2018 because of renewable energy.”,Viral image,"23, 2021 2021",barely-true,FALSE,0
2049,Ciara O'Rourke,"“Heidi Cruz, Ted’s wife, is managing director of Goldman Sachs. They oversee the Texas utilities.”",Facebook posts,"23, 2021 2021",barely-true,FALSE,0
2050,Ciara O'Rourke,“Utah OFFICIALLY starts RECALL for Mitt Romney.”,Facebook posts,"23, 2021 2021",false,FALSE,0
2051,Ciara O'Rourke,Jill Biden was a teenage babysitter for Joe Biden’s family.,Viral image,"22, 2021 2021",false,FALSE,0
2052,Daniel Funke,“Joe Biden’s Dept. of Energy Blocked Texas from Increasing Power Ahead of Killer Storm”,Infowars,"22, 2021 2021",pants-fire,FALSE,0
2053,Samantha Putterman,Says Joe Biden didn’t act in response to the emergency in Texas.,Facebook posts,"19, 2021 2021",false,FALSE,0
2054,Ciara O'Rourke,"A Texas energy company billed a customer more than $200,000.",Viral image,"19, 2021 2021",half-true,FALSE,0
2055,Madison Czopek,"“If you make $50,000/year, $36 of your taxes goes to food stamps. $4,000 goes to corporate subsidies.”",Facebook posts,"19, 2021 2021",false,FALSE,0
2056,Daniel Funke,"Donald Trump's second impeachment ""cost $33 million.""",Facebook posts,"19, 2021 2021",false,FALSE,0
2057,Ciara O'Rourke,"Says Ted Cruz tweeted, “I’ll believe in climate change when Texas freezes over.”",Viral image,"19, 2021 2021",false,FALSE,0
2058,Noah Y.,The snow is government-generated or fake.,Facebook posts,"February 19, 19,",pants-fire,FALSE,0
2059,Tom Kertscher,Photo shows an ice mass hanging inside a Houston home during Texas winter storms.,Facebook posts,"19, 2021 2021",false,FALSE,0
2060,Tom Kertscher,“FEMA is paying for hotel rooms!!!” for Texas winter storm victims.,Facebook posts,"19, 2021 2021",false,FALSE,0
2061,Tom Kertscher,Says Joe Biden “helps build Afghanistan’s pipeline.”,Facebook posts,"18, 2021 2021",false,FALSE,0
2062,Tom Kertscher,“The United States was energy independent in 2019 for the first time since 1957. In just 10 days we are sent back 50 years.”,Facebook posts,"18, 2021 2021",barely-true,FALSE,0
2063,Tom Kertscher,Says Joe Biden “will redirect the $30 billion” that Donald Trump “left for U.S. farmers to ‘climate change.’”,Facebook posts,"18, 2021 2021",barely-true,FALSE,0
2064,Daniel Funke,"""Schools are trying to make a law that teachers can see girls' private parts to make sure they're not trans.""",TikTok posts,"17, 2021 2021",barely-true,FALSE,0
2065,Tom Kertscher,“Biden signs 45% capital gains tax. Kiss your inheritance goodbye.”,Facebook posts,"16, 2021 2021",false,FALSE,0
2066,Noah Y.,Says death reports in federal database show the fatal risk of COVID-19 vaccines.,Facebook posts,"February 16, 16,",barely-true,FALSE,0
2067,Daniel Funke,"Says Joe Biden planned a winter storm as ""warfare, an attack on Texas by altering the jet stream.""",Facebook posts,"16, 2021 2021",pants-fire,FALSE,0
2068,Ciara O'Rourke,“NASA admits that man-made climate change is a hoax!”,Viral image,"16, 2021 2021",false,FALSE,0
2069,Ciara O'Rourke,Photo shows the “USS Al Gore Global Warming Research Vessel” covered in ice.,Viral image,"16, 2021 2021",false,FALSE,0
2070,Madison Czopek,Says Nabisco is closing plants in Georgia and New Jersey and “moving to Mexico” because of Biden’s election.,Facebook posts,"15, 2021 2021",false,FALSE,0
2071,Tom Kertscher,Says Joe Biden’s order stopping the Keystone pipeline “made oil more expensive for us to use.”,Facebook posts,"15, 2021 2021",barely-true,FALSE,0
2072,Daniel Funke,"Doctors and nurses who administer the coronavirus vaccine can be ""tried as war criminals.""",Bloggers,"11, 2021 2021",pants-fire,FALSE,0
2073,Tom Kertscher,"""The Clinton Foundation folded.”",Facebook posts,"11, 2021 2021",pants-fire,FALSE,0
2074,Ciara O'Rourke,"Says Gorilla Glue tweeted, “Do not use our products on your f------ hair.”",Viral image,"10, 2021 2021",false,FALSE,0
2075,Tom Kertscher,"""The Biden family is so heavily invested in oil and energy in other countries.""",Facebook posts,"10, 2021 2021",barely-true,FALSE,0
2076,Daniel Funke,“Not one court has looked at the evidence and said that Biden legally won” the presidential election.,Facebook posts,"10, 2021 2021",pants-fire,FALSE,0
2077,Ciara O'Rourke,Photo shows Tampa Mayor Jane Castor maskless at Super Bowl.,Viral image,"10, 2021 2021",false,FALSE,0
2078,Samantha Putterman,Says Cracker Barrel’s name has racist origins and its logo depicts a whip.,Facebook posts,"9, 2021 2021",false,FALSE,0
2079,Daniel Funke,"""Trump Won Two-Thirds of Election Lawsuits Where Merits Considered""",Bloggers,"9, 2021 2021",false,FALSE,0
2080,Jill Terreri,The COVID-19 vaccine “went out for distribution” in Nebraska “days before the FDA even said they were going to approve it.”,Lee Merritt,"February 9, 9,",false,FALSE,0
2081,Noah Y.,"“Biden’s Air Force One is not the same as Trump’s Air Force One,” which indicates Biden is not the real president.",Facebook posts,"February 9, 9,",pants-fire,FALSE,0
2082,Ciara O'Rourke,Photo shows Joe Biden asleep at his desk.,Viral image,"9, 2021 2021",false,FALSE,0
2083,Bill McCarthy,"Says Joe Biden said, “Buy a man eat fish, he day, teach fish man, to a lifetime.""",Facebook posts,"9, 2021 2021",pants-fire,FALSE,0
2084,Ciara O'Rourke,Michelle Obama earned a doctorate after leaving the White House.,Viral image,"9, 2021 2021",false,FALSE,0
2085,Samantha Putterman,“Pfizer and Moderna could share their design with dozens of other pharma companies who stand ready to produce their vaccines and end the pandemic.”,Facebook posts,"9, 2021 2021",barely-true,FALSE,0
2086,Bill McCarthy,"""Satan flashed in the halftime Super Bowl satanic ritual.""",Facebook posts,"8, 2021 2021",false,FALSE,0
2087,Noah Y.,"“New evidence ties COVID-19 creation to research funded by Fauci""",WorldNetDaily,"February 8, 8,",false,FALSE,0
2088,Ciara O'Rourke,"“Shell Oil laying off 9,000 workers” because of Joe Biden.",Facebook posts,"8, 2021 2021",false,FALSE,0
2089,Ciara O'Rourke,“Military rescues tortured children from tunnel beneath Capitol Hill.”,Bloggers,"8, 2021 2021",pants-fire,FALSE,0
2090,Tom Kertscher,“Doctor proves masks don’t work” by vaping through them.,Facebook posts,"8, 2021 2021",false,FALSE,0
2091,Madison Czopek,"""BUSTED: CDC Inflated COVID Numbers, Accused of Violating Federal Law""",Bloggers,"5, 2021 2021",false,FALSE,0
2092,Clara Hendrickson,“Newly discovered video shows late night deliveries of tens of thousands of illegal ballots 8 hours after deadline.”,The Gateway Pundit,"5, 2021 2021",false,FALSE,0
2093,Tom Kertscher,Seniors around the world who died from COVID vaccine are being improperly listed as “natural causes.”,Facebook posts,"5, 2021 2021",false,FALSE,0
2094,Tom Kertscher,"“A Miracle! Only 23 Americans Tested Positive for Flu Last Week Compared to 14,657 Cases Reported Last Year at Same Time.”",Facebook posts,"5, 2021 2021",half-true,FALSE,0
2095,Louis Jacobson,"Under the 2017 tax law, “people who make under $75,000 will have their taxes raised in 2021 and every 2 years after that until 2027.”",Facebook posts,"5, 2021 2021",barely-true,FALSE,0
2096,Ciara O'Rourke,"“Trump assassination foiled, Deep State in panic mode!”",Bloggers,"4, 2021 2021",false,FALSE,0
2097,Daniel Funke,Photo shows Democratic protesters who “stormed the U.S. Capitol in 2018.”,Facebook posts,"4, 2021 2021",false,FALSE,0
2098,Ciara O'Rourke,"Says Denzel Washington said, “I support police over BLM, don’t put them down!”",Bloggers,"4, 2021 2021",barely-true,FALSE,0
2099,Samantha Putterman,Says Joe Biden “has officially lowered the age of consent to 5 years old.”,Instagram posts,"4, 2021 2021",pants-fire,FALSE,0
